{
  "generated_on": "2026-09-24",
  "manuscript_profile": "research/publication/manuscript-profile.json",
  "search_notes": "Candidatos derivados (1) dos periódicos onde a literatura do Evidence Ledger foi publicada (`pubtool venues`) e (2) dos periódicos dos trabalhos que citaram Kahn-Lang (2016) (Scite citation_graph). Sites das editoras bloqueados no ambiente de geração: aims & scope NOT_VERIFIED para todos. Lista não exaustiva: diretórios (DOAJ, SciELO, Redalyc) não puderam ser consultados.",
  "candidates": [
    {
      "slug": "utilities-policy",
      "journal": "Utilities Policy",
      "publisher": "Elsevier BV (segundo metadados do Scite)",
      "origin": [
        "venue de von Loessl & Wetzel (2022), S-0005, DOI 10.1016/j.jup.2022.101416",
        "citante de Kahn-Lang (2016) via Scite citation_graph"
      ],
      "aims_scope": {
        "status": "NOT_VERIFIED"
      },
      "comparable_articles": [
        "10.1016/j.jup.2022.101416"
      ],
      "next_step": "full_analysis",
      "next_step_reason": "artigo diretamente comparável publicado em 2022"
    },
    {
      "slug": "energy-policy",
      "journal": "Energy Policy",
      "publisher": "Elsevier BV (segundo metadados do Scite)",
      "origin": [
        "venue de Datta (2019), S-0004, DOI 10.1016/j.enpol.2019.05.005",
        "citante de Kahn-Lang (2016)"
      ],
      "aims_scope": {
        "status": "NOT_VERIFIED"
      },
      "comparable_articles": [
        "10.1016/j.enpol.2019.05.005"
      ],
      "next_step": "full_analysis",
      "next_step_reason": "artigo comparável (2019), fora da janela de 5 anos"
    },
    {
      "slug": "the-energy-journal",
      "journal": "The Energy Journal",
      "publisher": "SAGE Publications (segundo metadados do Scite)",
      "origin": [
        "venue de Kahn-Lang (2016), S-0001",
        "venue de Arimura, Li & Newell (2012), S-0003"
      ],
      "aims_scope": {
        "status": "NOT_VERIFIED"
      },
      "comparable_articles": [
        "10.5547/01956574.37.4.jkah"
      ],
      "next_step": "hold",
      "next_step_reason": "comparáveis antigos (2012, 2016); perfil metodológico do periódico a verificar para uma revisão rápida"
    },
    {
      "slug": "the-electricity-journal",
      "journal": "The Electricity Journal",
      "publisher": "Elsevier BV (segundo metadados do Scite)",
      "origin": [
        "venue de Cappers et al. (2020), S-0002"
      ],
      "aims_scope": {
        "status": "NOT_VERIFIED"
      },
      "comparable_articles": [
        "10.1016/j.tej.2020.106858"
      ],
      "next_step": "hold",
      "next_step_reason": "publica análise aplicada de regulação elétrica (a verificar)"
    },
    {
      "slug": "energy-economics",
      "journal": "Energy Economics",
      "publisher": "NOT VERIFIED",
      "origin": [
        "venue de Brucal & Tarui (2021), citante de Kahn-Lang (2016), DOI 10.1016/j.eneco.2021.105440"
      ],
      "aims_scope": {
        "status": "NOT_VERIFIED"
      },
      "comparable_articles": [
        "10.1016/j.eneco.2021.105440"
      ],
      "next_step": "hold",
      "next_step_reason": "comparável trata de preços, não de programas de EE; revisão rápida pode não corresponder ao perfil (a verificar)"
    }
  ]
}
